{
  "$schema": "https://json-schema.org/draft/2020-12/schema",
  "title": "Line-based assessment of one agent run",
  "description": "Applicability, descriptive execution, grounding, and complete supplied net-diff/response accounting. Rules are in CC-oracle-check-instructions.md.",
  "type": "object",
  "properties": {
    "schema_version": {
      "const": "3.0"
    },
    "test_id": {
      "type": "string",
      "minLength": 1
    },
    "run_id": {
      "type": "string",
      "minLength": 1
    },
    "lines": {
      "type": "array",
      "items": {
        "oneOf": [
          {
            "$ref": "#/$defs/line"
          },
          {
            "$ref": "#/$defs/marker"
          }
        ]
      },
      "minItems": 1
    },
    "obligations": {
      "$ref": "#/$defs/grounding_map"
    },
    "unattributed": {
      "type": "array",
      "items": {
        "$ref": "#/$defs/unattributed"
      }
    },
    "assessment_issue": {
      "anyOf": [
        {
          "type": "object",
          "properties": {
            "description": {
              "type": "string",
              "minLength": 1
            }
          },
          "required": [
            "description"
          ],
          "additionalProperties": false
        },
        {
          "type": "null"
        }
      ]
    }
  },
  "required": [
    "schema_version",
    "test_id",
    "run_id",
    "lines",
    "obligations",
    "unattributed",
    "assessment_issue"
  ],
  "additionalProperties": false,
  "$defs": {
    "verdict": {
      "enum": [
        "demonstrated_correct",
        "demonstrated_incorrect",
        "not_established",
        null
      ]
    },
    "grounding_map": {
      "type": "object",
      "patternProperties": {
        "^[1-9][0-9]*$": {
          "$ref": "#/$defs/verdict"
        }
      },
      "additionalProperties": false
    },
    "evidence": {
      "type": "object",
      "properties": {
        "source": {
          "enum": [
            "diff",
            "response",
            "trajectory",
            "prompt",
            "card",
            "task_spec",
            "initial_state",
            "final_state",
            "domain_semantics"
          ]
        },
        "location": {
          "type": "string",
          "minLength": 1
        },
        "paragraphs": {
          "type": "array",
          "items": {
            "type": "integer",
            "minimum": 1
          },
          "minItems": 1,
          "uniqueItems": true
        }
      },
      "required": [
        "source",
        "location"
      ],
      "additionalProperties": false,
      "allOf": [
        {
          "if": {
            "required": [
              "paragraphs"
            ]
          },
          "then": {
            "properties": {
              "source": {
                "const": "response"
              }
            }
          }
        }
      ]
    },
    "line": {
      "type": "object",
      "properties": {
        "line": {
          "type": "integer",
          "minimum": 1
        },
        "task_status": {
          "enum": [
            "active",
            "inactive",
            null
          ]
        },
        "execution_status": {
          "enum": [
            "performed",
            "partially_performed",
            "execution_failed",
            "deferred",
            "skipped",
            "omitted",
            "interrupted",
            null
          ]
        },
        "grounding": {
          "$ref": "#/$defs/grounding_map"
        },
        "evidence": {
          "type": "array",
          "items": {
            "$ref": "#/$defs/evidence"
          },
          "uniqueItems": true
        },
        "explanation": {
          "type": "string",
          "minLength": 1
        }
      },
      "required": [
        "line",
        "task_status",
        "execution_status",
        "grounding",
        "evidence",
        "explanation"
      ],
      "additionalProperties": false
    },
    "marker": {
      "type": "object",
      "properties": {
        "line": {
          "type": "integer",
          "minimum": 1
        }
      },
      "required": [
        "line"
      ],
      "additionalProperties": false
    },
    "unattributed": {
      "type": "object",
      "properties": {
        "evidence": {
          "type": "array",
          "items": {
            "$ref": "#/$defs/evidence"
          },
          "uniqueItems": true,
          "minItems": 1
        },
        "explanation": {
          "type": "string",
          "minLength": 1
        }
      },
      "required": [
        "evidence",
        "explanation"
      ],
      "additionalProperties": false
    }
  }
}
