{
  "schema_version": "3.0",
  "test_id": "slack_62",
  "run_id": "54d5d6ce-4ee8-4731-90a6-36663c5fa30d",
  "lines": [
    {
      "line": 1,
      "task_status": "active",
      "execution_status": "performed",
      "grounding": {},
      "evidence": [
        {
          "source": "diff",
          "location": "/inserts/0"
        },
        {
          "source": "diff",
          "location": "/inserts/1"
        },
        {
          "source": "trajectory",
          "location": "/steps/0/observation/stdout"
        }
      ],
      "explanation": "Channel 'rl-project' was created successfully (channel_id CI9OP8MCQ9E), with the creator (acting user) automatically added as a member; no linked grounding obligations on this line."
    },
    {
      "line": 2,
      "task_status": "active",
      "execution_status": "performed",
      "grounding": {
        "1": "demonstrated_correct"
      },
      "evidence": [
        {
          "source": "diff",
          "location": "/inserts/2"
        },
        {
          "source": "trajectory",
          "location": "/steps/1/observation/stdout"
        },
        {
          "source": "trajectory",
          "location": "/steps/2/observation/stdout"
        },
        {
          "source": "response",
          "location": "/final",
          "paragraphs": [
            1
          ]
        }
      ],
      "explanation": "The agent listed users, correctly identified 'Morgan Stanley' as U05MORGAN23 (distinguishing from the also-present 'Morgan Freeman'), and invited that user to the new channel via conversations.invite, matching the resolved referent set in the grounding card. The final response accurately reports the channel name, ID, and successful addition of Morgan Stanley."
    }
  ],
  "obligations": {
    "1": "demonstrated_correct"
  },
  "unattributed": [],
  "assessment_issue": null
}
