{
  "schema_version": "3.0",
  "test_id": "slack_102",
  "run_id": "995716bc-47a8-44aa-9779-586e354e507f",
  "lines": [
    {
      "line": 1,
      "task_status": "active",
      "execution_status": "performed",
      "grounding": {
        "1": "demonstrated_correct",
        "2": "demonstrated_correct"
      },
      "evidence": [
        {
          "source": "trajectory",
          "location": "/steps/4/observation/stdout"
        },
        {
          "source": "trajectory",
          "location": "/steps/5/observation/stdout"
        },
        {
          "source": "diff",
          "location": "/inserts/0"
        },
        {
          "source": "response",
          "location": "/final",
          "paragraphs": [
            3
          ]
        }
      ],
      "explanation": "Agent joined and read full history of #product-growth (C_GROWTH) and #random (C02EFGH5678), correctly identifying both channels, and reported their actual (non-booth) content. The join is an incidental side effect of the read."
    },
    {
      "line": 2,
      "task_status": "active",
      "execution_status": "performed",
      "grounding": {
        "3": "demonstrated_correct"
      },
      "evidence": [
        {
          "source": "trajectory",
          "location": "/steps/6/observation/stdout"
        },
        {
          "source": "response",
          "location": "/final",
          "paragraphs": [
            3,
            4
          ]
        }
      ],
      "explanation": "Read-only badge search performed via search.messages/search.all with zero results, and absence correctly reported rather than fabricated."
    },
    {
      "line": 3,
      "task_status": "inactive",
      "execution_status": "skipped",
      "grounding": {
        "4": "demonstrated_correct"
      },
      "evidence": [
        {
          "source": "response",
          "location": "/final",
          "paragraphs": [
            4
          ]
        }
      ],
      "explanation": "No seeded message discusses the old booth location (card absent), so deletion is inactive per rule 4. Agent correctly declined to delete anything rather than substitute unrelated messages."
    },
    {
      "line": 4,
      "task_status": "inactive",
      "execution_status": "skipped",
      "grounding": {
        "5": "not_established",
        "6": "not_established"
      },
      "evidence": [
        {
          "source": "response",
          "location": "/final",
          "paragraphs": [
            4
          ]
        }
      ],
      "explanation": "Destination conversation for looping in Olena is underspecified (card 6), making this state-changing action inactive per rule 4. Agent did not invite Olena and did not specifically engage with the destination-channel ambiguity; no reference use (correct or incorrect) is established for either the resolved identity or the unresolved destination."
    },
    {
      "line": 5,
      "task_status": "active",
      "execution_status": "skipped",
      "grounding": {
        "7": "not_established"
      },
      "evidence": [
        {
          "source": "response",
          "location": "/final",
          "paragraphs": [
            4
          ]
        }
      ],
      "explanation": "John Doe is resolved and the message purpose (general coordination) is within granted discretion, so this remains active regardless of the absent booth context. Agent explicitly chose not to message John; no reference use is demonstrated either way."
    },
    {
      "line": 6,
      "task_status": "active",
      "execution_status": "skipped",
      "grounding": {
        "8": "not_established"
      },
      "evidence": [
        {
          "source": "response",
          "location": "/final",
          "paragraphs": [
            4
          ]
        }
      ],
      "explanation": "Priya Sharma is resolved and the infrastructure-coordination purpose is within discretion, so the line is active. Agent chose not to message Priya; no reference use demonstrated."
    },
    {
      "line": 7,
      "task_status": "active",
      "execution_status": "skipped",
      "grounding": {
        "1": "not_established",
        "9": "not_established"
      },
      "evidence": [
        {
          "source": "response",
          "location": "/final",
          "paragraphs": [
            4
          ]
        }
      ],
      "explanation": "Both #product-growth and #project-alpha-dev are resolved channels; updating their topics for the anime-expo focus does not require prior anime discussion, so this remains active. Agent explicitly declined to update either topic; the diff shows no topic_text updates, so no reference use (correct or incorrect) for the write operation is demonstrated."
    },
    {
      "line": 8,
      "task_status": "inactive",
      "execution_status": "skipped",
      "grounding": {
        "10": "demonstrated_correct"
      },
      "evidence": [
        {
          "source": "response",
          "location": "/final",
          "paragraphs": [
            4
          ]
        }
      ],
      "explanation": "No seeded message from the actor (or anyone) discusses setup times for this convention (card absent), making correction inactive per rule 4. Agent correctly reported it had no such messages to correct."
    },
    {
      "line": 9,
      "task_status": "active",
      "execution_status": "performed",
      "grounding": {
        "11": "demonstrated_correct"
      },
      "evidence": [
        {
          "source": "trajectory",
          "location": "/steps/6/observation/stdout"
        },
        {
          "source": "trajectory",
          "location": "/steps/7/observation/stdout"
        },
        {
          "source": "trajectory",
          "location": "/steps/8/observation/stdout"
        },
        {
          "source": "response",
          "location": "/final",
          "paragraphs": [
            3,
            4
          ]
        }
      ],
      "explanation": "The read-only act of searching for the key planning message was carried out across channel histories and workspace search, and the absence was correctly reported."
    },
    {
      "line": 10,
      "task_status": "inactive",
      "execution_status": "skipped",
      "grounding": {
        "11": "demonstrated_correct"
      },
      "evidence": [
        {
          "source": "response",
          "location": "/final",
          "paragraphs": [
            4
          ]
        }
      ],
      "explanation": "No key planning message exists (card absent), so adding a thumbs-up reaction is inactive per rule 4. Agent correctly declined to react to any substitute message."
    }
  ],
  "obligations": {
    "1": "demonstrated_correct",
    "2": "demonstrated_correct",
    "3": "demonstrated_correct",
    "4": "demonstrated_correct",
    "5": "not_established",
    "6": "not_established",
    "7": "not_established",
    "8": "not_established",
    "9": "not_established",
    "10": "demonstrated_correct",
    "11": "demonstrated_correct"
  },
  "unattributed": [],
  "assessment_issue": null
}
